IssueType,DeviceType,IssueTime,IssueDetails,MobileNumber,emailId,mode,cdn,DeviceDetails,OSDetails,platform,new_Platform,AppVersion,country,state,NetworkStrength,contentID,AdvertiseVideo,userIdentifier,ContractId,Customer_Id,ComplaintId
Better user interface and workability,Laptop,12/05/2022 00:00:00,dolor vel est donec odio justo sollicitudin ut suscipit a feugiat et eros,2224378378,dmcintoshjn@jalbum.net,Chat,Cloudfront,Android TV,Android TV 1st Generation,Zee5,,Android TV 12.3.2,Taiwan,Taipei,,1c861dd7-60e1-40b8-a4f7-fb2fce028e75,Video,kristinharding,27-5030828,1516902,1575279
Response Time in different networks,Laptop,05/12/2021 00:00:00,pede venenatis non sodales sed tincidunt eu felis fusce posuere felis sed,5486782519,nhordelljo@godaddy.com,Phone Call,Cloudfront,Roku,Roku OS 9.4 3rd Generation,Amazon Prime Video,,None,Christmas Island,Flying Fish Cove,,e0f06051-e46d-4580-8fef-7b515c571877,Video,kennethgriffin,05-0205094,1127273,43433
Better user interface and workability,TV,01/03/2022 00:00:00,eleifend luctus ultricies eu nibh quisque id justo sit amet sapien dignissim vestibulum vestibulum ante ipsum primis in,8549153028,abeardmorejp@indiatimes.com,Phone Call,Akamai,Amazon Fire TV,All Fire TV devices,Sling TV,,FireOS 7.6.1.3,Madagascar,Antananarivo,,3428f71d-9a9c-4bc1-bed2-75b279ab8b78,Advertise,vkim,48-1095918,1789670,406996
Offline content,Desktop,23/12/2021 00:00:00,enim leo rhoncus sed vestibulum sit amet cursus id turpis integer aliquet massa id lobortis convallis tortor risus dapibus augue,7542328506,smcdougaljq@ed.gov,Chat,Cloudfront,Universal Windows Platform (UWP),Xbox One X/S,Eros Now,,Windows 10,Montserrat,Plymouth,,436b8dbf-4aaf-4bda-8b3d-01a31fbda41d,Video,larry92,20-0792828,1215142,2440139
Playback Quality,Mobile,07/11/2022 00:00:00,dolor sit amet consectetuer adipiscing elit proin interdum mauris non ligula pellentesque ultrices phasellus id sapien in sapien,5002863744,ddenkeljr@ed.gov,Email,Cloudfront,Samsung Tizen TV,21TV_PREMIUM2,Netflix,,Extension 6.5,Moldova,Chisinau,,8a02b09c-15f0-4dde-89ac-dad3349fcba8,Video,karenodom,21-9374891,1346719,1473805
Customer Support,Mobile,17/11/2022 00:00:00,dis parturient montes nascetur ridiculus mus vivamus vestibulum sagittis sapien cum sociis natoque penatibus et magnis dis parturient,6830313430,adunkertonjs@fastcompany.com,Email,Akamai,iOS,iOS Min version 12.6,Sonyliv,,macOS Ventura 13.0.1,Trinidad and Tobago,Port of Spain,,6aa06787-d71b-42ed-bff6-d8cc9a18e67f,Video,thomascrawford,09-0413332,1280395,2365104
Response Time in different networks,Desktop,01/01/2022 00:00:00,sit amet eleifend pede libero quis orci nullam molestie nibh in lectus pellentesque at nulla,4619830046,ddelionjt@bing.com,Email,Cloudfront,tvOS,tvOS 11.0,Voot,,Xcode 14.1,Tunisia,Tunis,,a10be01f-a74b-46ca-a023-10093366ea98,Video,vangmelissa,97-1399838,1695246,1543804
Customer Support,Mobile,09/04/2022 00:00:00,pede ullamcorper augue a suscipit nulla elit ac nulla sed vel enim sit amet nunc viverra dapibus nulla suscipit ligula,3659171913,rtackerju@state.tx.us,Phone Call,Akamai,Android,Android 5.0,Airtel Xstream,,Android 11,Bhutan,Thimphu,,9103f1b4-5117-45c4-b914-43cc03e1c322,Advertise,fhester,60-9152950,1372926,2436309
Playback Quality,Tablets,26/02/2022 00:00:00,rutrum rutrum neque aenean auctor gravida sem praesent id massa id nisl,7191738480,mshortenjv@dailymotion.com,Email,Akamai,Android TV,Android TV 1st Generation,Amazon Prime Video,,Android TV 12.3.2,Democratic Republic of the Congo,Kinshasa,,129e19c1-8086-479a-a812-c1f1130aa7d9,Advertise,bsaunders,97-2788470,1314021,1413572
Response Time in different networks,Tablets,20/02/2022 00:00:00,volutpat eleifend donec ut dolor morbi vel lectus in quam fringilla rhoncus mauris,26384248,ajenkenjw@bandcamp.com,Email,Akamai,Roku,Roku OS 9.4 3rd Generation,Disney + Hotstar,,None,United Arab Emirates,Abu Dhabi,,baf61031-c283-407e-9e20-a358b665bdcb,Advertise,hartmelissa,41-7361055,1152616,450544
Better user interface and workability,Desktop,28/11/2021 00:00:00,aliquet ultrices erat tortor sollicitudin mi sit amet lobortis sapien sapien non mi integer,8083570605,djeannotjx@va.gov,Chat,Cloudfront,Amazon Fire TV,All Fire TV devices,HBO Max,,FireOS 7.6.1.3,Aland Islands,Mariehamn,,806fc740-ab53-4e79-bf66-3d2a4f6c21fd,Advertise,khudson,17-4437239,1849511,1178368
Playback Quality,TV,28/06/2022 00:00:00,elementum ligula vehicula consequat morbi a ipsum integer a nibh in quis justo maecenas rhoncus,2358211745,eroostanjy@nationalgeographic.com,Email,Akamai,Universal Windows Platform (UWP),Xbox One X/S,Hulu,,Windows 10,Sao Tome and Principe,Sao Tome,,7b8d34b0-e157-4a8d-afa9-76d36fd0f396,Video,qowens,03-0761350,1153145,1759876
Customer Support,Laptop,08/04/2022 00:00:00,consequat ut nulla sed accumsan felis ut at dolor quis odio consequat varius integer ac leo pellentesque ultrices,1981185143,ljanczykjz@elegantthemes.com,Phone Call,Akamai,Samsung Tizen TV,21TV_PREMIUM2,YouTube TV,,Extension 6.5,French Guiana,Cayenne,,ac01901f-a863-454f-aeae-90b8de74bb8c,Video,hodom,04-7866458,1532256,1061906
Response Time in different networks,Mobile,30/01/2022 00:00:00,in purus eu magna vulputate luctus cum sociis natoque penatibus et magnis,7924682066,gconersk0@yale.edu,Chat,Cloudfront,iOS,iOS Min version 12.6,Zee5,,macOS Ventura 13.0.1,Cook Islands,Avarua,,ef821253-0ec7-40ff-9bda-376a816ca8af,Advertise,anthony31,83-6647061,1392809,918307
Playback Quality,Laptop,13/11/2022 00:00:00,ac diam cras pellentesque volutpat dui maecenas tristique est et tempus semper,2940628491,akestiank1@mapquest.com,Chat,Cloudfront,tvOS,tvOS 11.0,Voot,,Xcode 14.1,Namibia,Windhoek,,5a77b2e2-25bf-474a-98c0-dbe1a6c0ccc9,Video,ashleylozano,71-2325623,1619368,2339749
Multiple user accounts,Mobile,12/06/2022 00:00:00,risus auctor sed tristique in tempus sit amet sem fusce consequat nulla nisl,9275045011,nhedylstonek2@irs.gov,Chat,Cloudfront,Android,Android 5.0,Hulu,,Android 11,Ghana,Accra,,14ef9006-2a7c-4f44-b41b-41fb194b6183,Advertise,fgonzalez,47-5380718,1133947,850229
Personalized suggestions and recommendations for content,Mobile,12/08/2022 00:00:00,nibh in hac habitasse platea dictumst aliquam augue quam sollicitudin vitae,2102855198,dalmeyk3@bigcartel.com,Phone Call,Cloudfront,Android TV,Android TV 1st Generation,Sonyliv,,Android TV 12.3.2,Saint Helena,Jamestown,,dc70baa1-b5ff-48e7-84f6-44575f47011d,Advertise,brandy93,92-2108614,1169619,2420218
Functionalities and features of the app,Laptop,05/10/2022 00:00:00,faucibus orci luctus et ultrices posuere cubilia curae nulla dapibus dolor vel est donec odio justo sollicitudin,6899620227,dhandrickk4@gravatar.com,Email,Cloudfront,Roku,Roku OS 9.4 3rd Generation,Sonyliv,,None,Palestinian Territory,East Jerusalem,,959e480b-8d88-4434-951c-3f0c010840a1,Video,smurphy,79-5291860,1215207,1593394
Multiple user accounts,Desktop,25/08/2022 00:00:00,pulvinar lobortis est phasellus sit amet erat nulla tempus vivamus in felis,1773718134,cmeedendorpek5@bandcamp.com,Email,Cloudfront,Amazon Fire TV,All Fire TV devices,HBO Max,,FireOS 7.6.1.3,Micronesia,Palikir,,1ca0320f-45c6-44f4-a973-fca02615c9d1,Video,brittany70,73-8297510,1349113,2377534
Response Time in different networks,Laptop,25/06/2022 00:00:00,amet lobortis sapien sapien non mi integer ac neque duis bibendum,5704128726,saleswellk6@addtoany.com,Email,Cloudfront,Universal Windows Platform (UWP),Xbox One X/S,Zee5,,Windows 10,Jersey,Saint Helier,,5bf69720-0606-4cfe-a15a-b33f1976e9dd,Video,davidsonmichelle,28-4199722,1188964,891372
Personalized suggestions and recommendations for content,Mobile,05/10/2022 00:00:00,velit id pretium iaculis diam erat fermentum justo nec condimentum neque sapien placerat ante nulla justo,3346236994,emacgounk7@lycos.com,Email,Cloudfront,Samsung Tizen TV,21TV_PREMIUM2,Airtel Xstream,,Extension 6.5,Bangladesh,Dhaka,,33e49975-8b8b-4382-ab0e-d248d50ccbc8,Advertise,elizabethcompton,80-7892013,1695402,2202088
Response Time in different networks,Desktop,12/05/2022 00:00:00,accumsan tellus nisi eu orci mauris lacinia sapien quis libero nullam sit amet turpis elementum,2224234465,bcahalink8@vimeo.com,Phone Call,Cloudfront,iOS,iOS Min version 12.6,HBO Max,,macOS Ventura 13.0.1,Sint Maarten,Philipsburg,,9d8f222a-abf7-4998-b874-ced444004d23,Advertise,rsanchez,56-0762003,1183707,78668
Response Time in different networks,TV,02/06/2022 00:00:00,consequat ut nulla sed accumsan felis ut at dolor quis odio consequat varius integer ac leo,7671923605,klauderk9@ezinearticles.com,Email,Akamai,tvOS,tvOS 11.0,Sonyliv,,Xcode 14.1,China,Beijing,,df864342-4c7d-44f3-8dfa-63b9a978058c,Video,evanvelasquez,15-2657764,1216943,925484
Device/Browser Compatibility,TV,18/12/2021 00:00:00,sed lacus morbi sem mauris laoreet ut rhoncus aliquet pulvinar sed nisl nunc rhoncus dui,3008963625,pparradyeka@skype.com,Phone Call,Akamai,Android,Android 5.0,Disney + Hotstar,,Android 11,Republic of the Congo,Brazzaville,,085e5dca-ba8d-4125-a2a2-afcaf053bdc2,Advertise,juliagilmore,91-7917330,1782832,1830438
Offline content,Laptop,10/01/2022 00:00:00,mi pede malesuada in imperdiet et commodo vulputate justo in blandit ultrices enim,2875271075,elambertkb@china.com.cn,Chat,Akamai,Android TV,Android TV 1st Generation,Hulu,,Android TV 12.3.2,Montenegro,Podgorica,,becc30d3-1937-43ab-98c9-76d4179dc5a4,Video,nlee,38-3048700,1892474,1492393
Multiple user accounts,TV,30/12/2021 00:00:00,enim blandit mi in porttitor pede justo eu massa donec,9680478084,bharrhykc@nbcnews.com,Email,Akamai,Roku,Roku OS 9.4 3rd Generation,Peacock,,None,Puerto Rico,San Juan,,773f2321-406c-4241-86f3-973867d62659,Video,brownjoseph,08-4004037,1652800,80646
Better user interface and workability,Laptop,24/01/2022 00:00:00,quisque id justo sit amet sapien dignissim vestibulum vestibulum ante ipsum primis in faucibus orci luctus et ultrices posuere cubilia,5185502118,mcullivankd@smugmug.com,Email,Akamai,Amazon Fire TV,All Fire TV devices,Disney + Hotstar,,FireOS 7.6.1.3,Turkey,Ankara,,b0b014fe-c91a-47c4-87a3-7daedea5d2e0,Advertise,carterroger,68-2010011,1643428,386711
Response Time in different networks,Tablets,18/08/2022 00:00:00,faucibus orci luctus et ultrices posuere cubilia curae donec pharetra magna vestibulum aliquet ultrices erat tortor sollicitudin mi,2308363436,wnooreke@skyrock.com,Phone Call,Cloudfront,Universal Windows Platform (UWP),Xbox One X/S,Hulu,,Windows 10,Mauritius,Port Louis,,e023100e-7010-4063-ae90-39087c2a2b61,Advertise,brewerpreston,59-3169566,1221330,2137709
Device/Browser Compatibility,Tablets,12/11/2022 00:00:00,nulla nunc purus phasellus in felis donec semper sapien a libero,7124055148,gorsikf@home.pl,Email,Cloudfront,Samsung Tizen TV,21TV_PREMIUM2,YouTube TV,,Extension 6.5,Nauru,Yaren,,56a6e361-a5e1-4022-97be-95313b9cba53,Advertise,peter84,67-7373783,1106688,2424250
Better user interface and workability,Tablets,27/08/2022 00:00:00,lorem ipsum dolor sit amet consectetuer adipiscing elit proin interdum mauris non ligula pellentesque ultrices phasellus id sapien in sapien,4074719142,kmaddamskg@thetimes.co.uk,Email,Akamai,iOS,iOS Min version 12.6,Alt Balaji,,macOS Ventura 13.0.1,Belarus,Minsk,,30850049-12cc-4433-ba0f-22983908155a,Advertise,maxwellthomas,56-3924513,1264018,2380170
Offline content,Laptop,04/10/2022 00:00:00,cum sociis natoque penatibus et magnis dis parturient montes nascetur ridiculus mus vivamus,3978353881,wboostkh@nasa.gov,Email,Cloudfront,tvOS,tvOS 11.0,Zee5,,Xcode 14.1,Norway,Oslo,,845d810d-ac33-43de-a83c-f42c05899f05,Advertise,edwardsandrew,89-3378278,1412879,1657338
Better user interface and workability,Tablets,21/05/2022 00:00:00,nam congue risus semper porta volutpat quam pede lobortis ligula,4864699704,wstentonki@marriott.com,Phone Call,Akamai,Android,Android 5.0,Hulu,,Android 11,Taiwan,Taipei,,b8903cd6-9b19-4c11-8557-a588003e16ce,Advertise,hahnderrick,59-0064973,1165210,2440660
Security and anti-piracy,Desktop,13/01/2022 00:00:00,integer aliquet massa id lobortis convallis tortor risus dapibus augue vel accumsan tellus nisi eu orci mauris lacinia sapien,6809862056,jcamackekj@nasa.gov,Chat,Akamai,Android TV,Android TV 1st Generation,Facebook Watch,,Android TV 12.3.2,Christmas Island,Flying Fish Cove,,0bca01d1-48cd-4f32-b989-7095b17a639b,Advertise,kristysilva,43-8157405,1399194,1217470
Multiple user accounts,Laptop,22/04/2022 00:00:00,consequat dui nec nisi volutpat eleifend donec ut dolor morbi vel lectus in quam fringilla rhoncus mauris,3286707872,lhanscombekk@hud.gov,Email,Cloudfront,Roku,Roku OS 9.4 3rd Generation,Sonyliv,,None,Madagascar,Antananarivo,,fd36f90f-89d5-409e-b1d2-aeafe57f81c9,Video,karen40,84-4176353,1833657,287457
Playback Quality,TV,05/06/2022 00:00:00,imperdiet sapien urna pretium nisl ut volutpat sapien arcu sed augue aliquam erat volutpat in congue,2438036877,gchateletkl@qq.com,Email,Cloudfront,Amazon Fire TV,All Fire TV devices,Amazon Prime Video,,FireOS 7.6.1.3,Montserrat,Plymouth,,6ea57440-a929-452e-bd7d-892220ef06a5,Advertise,xlewis,36-5299442,1292645,1653736
Response Time in different networks,Tablets,18/06/2022 00:00:00,vestibulum quam sapien varius ut blandit non interdum in ante vestibulum ante ipsum primis,6792345539,bsherringhamkm@g.co,Chat,Cloudfront,Universal Windows Platform (UWP),Xbox One X/S,ShemarooMe,,Windows 10,Moldova,Chisinau,,ee8c0370-fe9d-43a0-8d09-6ef1e6e49334,Video,kimberly77,25-1882296,1536162,375629
Offline content,Mobile,21/04/2022 00:00:00,eu felis fusce posuere felis sed lacus morbi sem mauris laoreet ut rhoncus aliquet pulvinar sed nisl nunc,9064422796,gmacpeicekn@ifeng.com,Chat,Cloudfront,Samsung Tizen TV,21TV_PREMIUM2,Jio Tv,,Extension 6.5,Trinidad and Tobago,Port of Spain,,50aa7adb-9ddf-401b-9cf8-88c4ea8ccbd1,Advertise,jessica41,62-8816564,1668971,1072179
Playback Quality,Desktop,17/10/2022 00:00:00,suspendisse accumsan tortor quis turpis sed ante vivamus tortor duis mattis egestas metus aenean fermentum donec ut mauris eget,3792555581,afreeberneko@oaic.gov.au,Chat,Akamai,iOS,iOS Min version 12.6,Sonyliv,,macOS Ventura 13.0.1,Tunisia,Tunis,,801ae794-903a-472a-bd53-320479e7b5a3,Video,mbailey,30-4436584,1216844,105
Security and anti-piracy,TV,30/10/2022 00:00:00,adipiscing elit proin interdum mauris non ligula pellentesque ultrices phasellus id sapien in sapien iaculis congue vivamus metus arcu,3694271341,kbramfordkp@feedburner.com,Email,Cloudfront,tvOS,tvOS 11.0,BigFlix,,Xcode 14.1,Bhutan,Thimphu,,5cca41cf-359a-4155-bfda-7a404950af84,Advertise,robert59,42-0246097,1601024,1572576
Device/Browser Compatibility,TV,10/08/2022 00:00:00,odio consequat varius integer ac leo pellentesque ultrices mattis odio donec vitae nisi nam ultrices,5152703602,hjohanssenkq@shutterfly.com,Phone Call,Akamai,Android,Android 5.0,Mx Player,,Android 11,Democratic Republic of the Congo,Kinshasa,,f2a98a67-3be2-49fb-8b09-c46187ee34f1,Video,jennifer81,45-4491524,1391686,1877846
Functionalities and features of the app,Desktop,12/01/2022 00:00:00,faucibus orci luctus et ultrices posuere cubilia curae mauris viverra,5496594138,wknillkr@cnbc.com,Email,Akamai,Android TV,Android TV 1st Generation,Sonyliv,,Android TV 12.3.2,United Arab Emirates,Abu Dhabi,,5d238b35-028f-4d34-805f-59793e327873,Advertise,jmays,96-0015505,1504217,913555
Device/Browser Compatibility,TV,31/08/2022 00:00:00,cubilia curae mauris viverra diam vitae quam suspendisse potenti nullam,6489022842,vmuschetteks@bluehost.com,Chat,Akamai,Roku,Roku OS 9.4 3rd Generation,Jio Tv,,None,Aland Islands,Mariehamn,,55cc8ddd-cc6c-41cc-b404-2473d5663ba2,Video,donna86,15-2789783,1800745,198773
Playback Quality,Desktop,29/07/2022 00:00:00,velit id pretium iaculis diam erat fermentum justo nec condimentum neque sapien placerat ante nulla,4618634871,dlorekkt@google.co.uk,Phone Call,Akamai,Amazon Fire TV,All Fire TV devices,Sling TV,,FireOS 7.6.1.3,Sao Tome and Principe,Sao Tome,,95e5a4db-9f49-4a7a-b2b2-98fd3e829084,Advertise,scottkey,39-7913659,1282922,2422888
Customer Support,Desktop,31/03/2022 00:00:00,nulla suscipit ligula in lacus curabitur at ipsum ac tellus semper interdum mauris ullamcorper purus sit amet nulla quisque arcu,372203582,tizhakku@jimdo.com,Phone Call,Akamai,Universal Windows Platform (UWP),Xbox One X/S,Mx Player,,Windows 10,Peru,Lima,,e5c96bae-4b51-49c0-9bb2-86e5cf8b71f0,Advertise,umiller,38-9290007,1837579,1065025
Multiple user accounts,Mobile,13/12/2021 00:00:00,ultrices erat tortor sollicitudin mi sit amet lobortis sapien sapien non mi integer,3500409563,tdirkinkv@naver.com,Phone Call,Akamai,Samsung Tizen TV,21TV_PREMIUM2,HBO Max,,Extension 6.5,Croatia,Zagreb,,2c38b558-e558-4b23-9543-ce7332db3e19,Video,jhorn,35-8630432,1612689,1013900
Customer Support,Laptop,22/09/2022 00:00:00,mauris laoreet ut rhoncus aliquet pulvinar sed nisl nunc rhoncus dui vel sem sed sagittis nam congue,9771286285,bracherkw@phoca.cz,Chat,Cloudfront,iOS,iOS Min version 12.6,Voot,,macOS Ventura 13.0.1,Mayotte,Mamoudzou,,20dcb066-c89f-4193-8ea7-fc8f2f44dcca,Advertise,joycebaker,82-7011992,1746834,1028659
Customer Support,Laptop,21/01/2022 00:00:00,neque vestibulum eget vulputate ut ultrices vel augue vestibulum ante ipsum primis in faucibus,3953574884,bdedenhamkx@purevolume.com,Phone Call,Akamai,tvOS,tvOS 11.0,Netflix,,Xcode 14.1,Latvia,Riga,,809294de-4ec4-4241-94d0-6c3cffd3e485,Advertise,umontes,09-7487484,1708009,509653
Offline content,Tablets,16/10/2022 00:00:00,nullam varius nulla facilisi cras non velit nec nisi vulputate nonummy maecenas,9698702245,rcordeky@engadget.com,Phone Call,Cloudfront,Android,Android 5.0,Amazon Prime Video,,Android 11,Morocco,Rabat,,c4f34267-b937-47a1-bdff-844b33830c53,Advertise,julie59,41-3567262,1331312,1843146
Playback Quality,Laptop,31/07/2022 00:00:00,tempus vivamus in felis eu sapien cursus vestibulum proin eu mi nulla ac enim in tempor,1969565322,dkeseykz@paginegialle.it,Email,Cloudfront,Android TV,Android TV 1st Generation,Sling TV,,Android TV 12.3.2,South Sudan,Juba,,96dcb3aa-4b20-45cd-ad20-6a153afaeeef,Video,pattersonjohn,68-8365912,1621486,1773768
Personalized suggestions and recommendations for content,Tablets,06/03/2022 00:00:00,sapien non mi integer ac neque duis bibendum morbi non quam,4722574111,wthurnhaml0@amazon.co.jp,Phone Call,Akamai,Roku,Roku OS 9.4 3rd Generation,Disney + Hotstar,,None,Bulgaria,Sofia,,3772d585-2cf3-4be1-8174-1c0ddcc4a69f,Video,zhale,78-4896822,1868234,536045
Security and anti-piracy,Tablets,27/02/2022 00:00:00,dolor sit amet consectetuer adipiscing elit proin risus praesent lectus vestibulum,8720097999,amccarthyl1@yelp.com,Chat,Cloudfront,Amazon Fire TV,All Fire TV devices,Mx Player,,FireOS 7.6.1.3,Panama,Panama City,,6be4cea7-62ee-43ca-87ca-b2836d17a10f,Advertise,matthewroberts,94-8707165,1358207,696581
Device/Browser Compatibility,Tablets,05/03/2022 00:00:00,mus vivamus vestibulum sagittis sapien cum sociis natoque penatibus et magnis dis parturient montes nascetur ridiculus mus etiam vel augue,8547447180,lsethl2@comsenz.com,Email,Cloudfront,Universal Windows Platform (UWP),Xbox One X/S,Hulu,,Windows 10,Kazakhstan,Astana,,790d0e9f-f81b-4612-a329-23f7ece8631f,Advertise,vburke,07-8930514,1888759,2145833
Device/Browser Compatibility,Tablets,14/09/2022 00:00:00,sodales scelerisque mauris sit amet eros suspendisse accumsan tortor quis turpis sed ante vivamus,823390829,pkeningtonl3@list/manage.com,Chat,Akamai,Samsung Tizen TV,21TV_PREMIUM2,Eros Now,,Extension 6.5,Uruguay,Montevideo,,d6e5c209-78c4-43ce-8d44-124ecbf3a4a2,Advertise,ihernandez,06-7037169,1239673,2413477
Playback Quality,Mobile,29/09/2022 00:00:00,nibh quisque id justo sit amet sapien dignissim vestibulum vestibulum ante ipsum primis in faucibus orci luctus et,5426552797,dmarlel4@webeden.co.uk,Chat,Akamai,iOS,iOS Min version 12.6,Peacock,,macOS Ventura 13.0.1,Uganda,Kampala,,86afd13a-da1a-4ef5-948f-0ae52e3b19d5,Video,davidsonshannon,68-6704184,1691986,2140702
Personalized suggestions and recommendations for content,Laptop,13/09/2022 00:00:00,eget semper rutrum nulla nunc purus phasellus in felis donec semper,9521880813,slaurenceaul5@e/recht24.de,Email,Cloudfront,tvOS,tvOS 11.0,Hulu,,Xcode 14.1,India,New Delhi,,8912e730-490d-43bc-8512-8ccc649e0200,Advertise,andreadunn,78-0948169,1298469,1752682
Customer Support,TV,11/04/2022 00:00:00,montes nascetur ridiculus mus vivamus vestibulum sagittis sapien cum sociis,7150472060,gpetzoltl6@tripadvisor.com,Phone Call,Cloudfront,Android,Android 5.0,Airtel Xstream,,Android 11,Papua New Guinea,Port Moresby,,67283396-a3b9-4de1-8df8-16933519e8bc,Advertise,fcarter,37-3481956,1197388,1837895
Multiple user accounts,TV,25/04/2022 00:00:00,fusce posuere felis sed lacus morbi sem mauris laoreet ut rhoncus aliquet pulvinar,484152408,mmickleml7@edublogs.org,Phone Call,Cloudfront,Android TV,Android TV 1st Generation,Sling TV,,Android TV 12.3.2,Cocos Islands,West Island,,45759d27-8361-46dd-bf61-7659864061ff,Advertise,zbrown,32-9456653,1721124,2048623
Better user interface and workability,Desktop,26/07/2022 00:00:00,in tempor turpis nec euismod scelerisque quam turpis adipiscing lorem vitae mattis nibh ligula nec sem duis aliquam convallis nunc,8885665128,amatuszynskil8@parallels.com,Phone Call,Akamai,Roku,Roku OS 9.4 3rd Generation,Facebook Watch,,None,Curacao,Willemstad,,eb5f021c-06e3-47ce-ba06-1bb297b33846,Advertise,vsolis,13-9447187,1462018,1183948
Offline content,Tablets,14/05/2022 00:00:00,integer ac neque duis bibendum morbi non quam nec dui,2994962152,wfordel9@jugem.jp,Chat,Cloudfront,Amazon Fire TV,All Fire TV devices,Mx Player,,FireOS 7.6.1.3,Malawi,Lilongwe,,b3da1d40-7bb9-4c5d-ad01-9b2d8be4e04e,Video,perkinsmeagan,30-7500210,1235848,820724
Functionalities and features of the app,Mobile,24/03/2022 00:00:00,rhoncus aliquet pulvinar sed nisl nunc rhoncus dui vel sem sed sagittis nam congue risus semper porta,7312433588,rwillgossla@umich.edu,Chat,Cloudfront,Universal Windows Platform (UWP),Xbox One X/S,Mx Player,,Windows 10,Solomon Islands,Honiara,,66b77b5f-f800-4294-a546-05d044040140,Video,nealgregory,48-0754554,1714471,1543730
Functionalities and features of the app,Mobile,06/01/2022 00:00:00,in sagittis dui vel nisl duis ac nibh fusce lacus purus aliquet at feugiat non pretium quis,1790557879,barterlb@hubpages.com,Email,Akamai,Samsung Tizen TV,21TV_PREMIUM2,Hulu,,Extension 6.5,Laos,Vientiane,,1a8300d6-3973-4068-a8b4-fe24f336aa82,Advertise,melanieclark,62-4202564,1425297,587589
Multiple user accounts,Tablets,29/09/2022 00:00:00,non quam nec dui luctus rutrum nulla tellus in sagittis dui vel nisl duis ac nibh,5911133636,gbricklebanklc@de.vu,Phone Call,Cloudfront,iOS,iOS Min version 12.6,Mx Player,,macOS Ventura 13.0.1,Lithuania,Vilnius,,c6a92521-2e57-470f-99b4-ae13d06d324e,Advertise,franklinjustin,32-2856707,1325035,2201449
Functionalities and features of the app,Tablets,13/02/2022 00:00:00,in consequat ut nulla sed accumsan felis ut at dolor quis odio consequat varius integer,6811267364,ncalladineld@cocolog/nifty.com,Chat,Cloudfront,tvOS,tvOS 11.0,Disney + Hotstar,,Xcode 14.1,Serbia,Belgrade,,92b146bb-7f59-442c-8798-6ba025b591d4,Video,meganrandall,87-5794846,1537731,757474
Device/Browser Compatibility,Tablets,01/07/2022 00:00:00,ullamcorper augue a suscipit nulla elit ac nulla sed vel enim sit amet nunc viverra dapibus nulla suscipit,8544981941,eimlockle@usnews.com,Email,Cloudfront,Android,Android 5.0,Hulu,,Android 11,Nicaragua,Managua,,26badbc8-4c60-4cc0-8a86-0574dfe390ed,Advertise,tuckersarah,43-1802273,1175864,1946585
Personalized suggestions and recommendations for content,Mobile,16/10/2022 00:00:00,ultrices posuere cubilia curae mauris viverra diam vitae quam suspendisse potenti nullam porttitor lacus at turpis,5283431622,ajerchelf@elegantthemes.com,Email,Akamai,Android TV,Android TV 1st Generation,Voot,,Android TV 12.3.2,French Guiana,Cayenne,,ab87ba73-af0f-4521-8db3-38b4722d1812,Video,christopherstevens,66-3420854,1278263,1239223
Customer Support,TV,25/11/2021 00:00:00,amet eleifend pede libero quis orci nullam molestie nibh in,7081319165,cwinkettlg@washingtonpost.com,Email,Akamai,Roku,Roku OS 9.4 3rd Generation,Sling TV,,None,Cook Islands,Avarua,,3558201e-e044-4adb-85d8-4c6e0536c237,Video,kimberly91,52-1199561,1700305,548495
Personalized suggestions and recommendations for content,Laptop,30/03/2022 00:00:00,faucibus orci luctus et ultrices posuere cubilia curae mauris viverra diam vitae quam suspendisse potenti nullam porttitor lacus at,3543599690,ttaleslh@blogs.com,Phone Call,Cloudfront,Amazon Fire TV,All Fire TV devices,Sling TV,,FireOS 7.6.1.3,Namibia,Windhoek,,b6eeba57-7134-4275-958c-164b6bda838c,Video,sharplisa,36-6239038,1730881,820292
Personalized suggestions and recommendations for content,Laptop,08/09/2022 00:00:00,et magnis dis parturient montes nascetur ridiculus mus vivamus vestibulum sagittis sapien cum,4569121594,sjimmisonli@google.com.hk,Chat,Akamai,Universal Windows Platform (UWP),Xbox One X/S,Voot,,Windows 10,Ghana,Accra,,6a17ba36-35b7-4789-9e4d-287f70d8afbd,Video,alicia36,30-5186223,1687239,2379040
Multiple user accounts,Mobile,26/04/2022 00:00:00,in sapien iaculis congue vivamus metus arcu adipiscing molestie hendrerit,2671215312,cwagnerinlj@zdnet.com,Email,Cloudfront,Samsung Tizen TV,21TV_PREMIUM2,Hulu,,Extension 6.5,Saint Helena,Jamestown,,5b7ba255-d216-4bdb-8c41-9957e0140ffe,Video,zhanson,69-7044303,1291883,2206968
Functionalities and features of the app,TV,06/10/2022 00:00:00,non velit nec nisi vulputate nonummy maecenas tincidunt lacus at velit vivamus vel nulla eget eros,4088009584,clyburnlk@over/blog.com,Phone Call,Cloudfront,iOS,iOS Min version 12.6,Amazon Prime Video,,macOS Ventura 13.0.1,Palestinian Territory,East Jerusalem,,2a9fb4f2-c526-4a6a-aee2-8f192eefd906,Advertise,millerscott,87-0146396,1876616,2280821
Security and anti-piracy,TV,21/09/2022 00:00:00,vehicula condimentum curabitur in libero ut massa volutpat convallis morbi odio odio elementum,4407961171,cbaurerichll@telegraph.co.uk,Chat,Cloudfront,tvOS,tvOS 11.0,BigFlix,,Xcode 14.1,Micronesia,Palikir,,e587493e-beac-41f3-81d4-9d9743fb018b,Advertise,johnwheeler,54-9263194,1888544,880335
