IssueType,DeviceType,IssueTime,IssueDetails,MobileNumber,emailId,mode,cdn,DeviceDetails,OSDetails,platform,new_Platform,AppVersion,country,state,NetworkStrength,contentID,AdvertiseVideo,userIdentifier,ContractId,Customer_Id,ComplaintId
Customer Support,Tablets,14/08/2022 00:00:00,in ante vestibulum ante ipsum primis in faucibus orci luctus et ultrices posuere cubilia curae duis faucibus accumsan,4049691779,dundrell7u@cargocollective.com,Email,Akamai,Android,Android 5.0,Amazon Prime Video,,Android 11,Yemen,Sanaa,,74269326-46ee-4841-beda-a249de8f2cc7,Advertise,hmckee,63-4007273,1131444,2425528
Device/Browser Compatibility,Laptop,15/04/2022 00:00:00,nisl duis ac nibh fusce lacus purus aliquet at feugiat non pretium quis lectus suspendisse potenti in eleifend quam a,8928553741,agierke7v@cornell.edu,Phone Call,Akamai,Android TV,Android TV 1st Generation,Peacock,,Android TV 12.3.2,Macao,Macao,,152144a0-53da-46fc-8b5e-2075d14f28fb,Video,nbailey,33-8922670,1844436,2424184
Customer Support,TV,12/01/2022 00:00:00,a ipsum integer a nibh in quis justo maecenas rhoncus aliquam lacus morbi quis tortor id,4048116428,aglanister7w@php.net,Chat,Cloudfront,Roku,Roku OS 9.4 3rd Generation,Eros Now,,None,Malta,Valletta,,a2bbf986-6dbb-4b12-85ef-6ada14d6e6b5,Video,shawn06,83-2286771,1856693,1756470
Response Time in different networks,Desktop,18/12/2021 00:00:00,eu nibh quisque id justo sit amet sapien dignissim vestibulum vestibulum ante ipsum primis,5146966370,bjuzek7x@tripadvisor.com,Phone Call,Akamai,Amazon Fire TV,All Fire TV devices,Zee5,,FireOS 7.6.1.3,Poland,Warsaw,,256e774a-2035-47de-964d-d5fce7628822,Advertise,greenluke,52-3278072,1405233,1312648
Functionalities and features of the app,Mobile,03/10/2022 00:00:00,odio condimentum id luctus nec molestie sed justo pellentesque viverra pede ac diam cras pellentesque volutpat dui,3373263204,zebourne7y@w3.org,Phone Call,Akamai,Universal Windows Platform (UWP),Xbox One X/S,BigFlix,,Windows 10,Egypt,Cairo,,572ae9f8-d0de-4057-b6ec-da89fff9000d,Video,clarkmarvin,00-8849143,1442483,423105
Response Time in different networks,Mobile,19/06/2022 00:00:00,aliquet pulvinar sed nisl nunc rhoncus dui vel sem sed sagittis nam congue risus,2518961232,jcharlson7z@friendfeed.com,Chat,Akamai,Samsung Tizen TV,21TV_PREMIUM2,Voot,,Extension 6.5,Saint Kitts and Nevis,Basseterre,,b9fdccea-da76-49d9-8ebc-f0a8bee31858,Advertise,chloemartin,60-4971018,1761078,1324467
Multiple user accounts,Laptop,05/09/2022 00:00:00,elit sodales scelerisque mauris sit amet eros suspendisse accumsan tortor quis turpis sed ante,5307773188,bhenden80@hp.com,Email,Cloudfront,iOS,iOS Min version 12.6,Hulu,,macOS Ventura 13.0.1,Qatar,Doha,,43241cc6-5514-45b4-9cb0-4dd01959eb0e,Advertise,nwhite,81-2416930,1838488,2416121
Response Time in different networks,Mobile,06/01/2022 00:00:00,mollis molestie lorem quisque ut erat curabitur gravida nisi at nibh in hac habitasse platea dictumst aliquam augue quam sollicitudin,6414422371,gbarde81@ted.com,Email,Cloudfront,tvOS,tvOS 11.0,Netflix,,Xcode 14.1,Jamaica,Kingston,,a89c368e-352e-49df-810e-421b7caf6d1b,Video,charlessanchez,59-2482393,1379318,1310721
Multiple user accounts,Desktop,06/08/2022 00:00:00,in faucibus orci luctus et ultrices posuere cubilia curae nulla dapibus dolor,3996378769,sjosefsen82@rediff.com,Email,Akamai,Android,Android 5.0,Amazon Prime Video,,Android 11,Sweden,Stockholm,,63a643f7-6131-4d20-8f41-dbc6f5f395e3,Advertise,jessica53,47-3701266,1688183,1415666
Security and anti-piracy,Laptop,18/09/2022 00:00:00,magna vestibulum aliquet ultrices erat tortor sollicitudin mi sit amet lobortis sapien sapien non mi integer ac neque,3201524603,agorgl83@stumbleupon.com,Email,Cloudfront,Android TV,Android TV 1st Generation,Hulu,,Android TV 12.3.2,French Guiana,Cayenne,,9796b0a8-ad49-4472-a2a9-81d65deefce4,Video,hgibson,10-5568149,1340983,1435290
Offline content,Mobile,24/03/2022 00:00:00,eu sapien cursus vestibulum proin eu mi nulla ac enim in tempor,2864416573,eelse84@facebook.com,Email,Cloudfront,Roku,Roku OS 9.4 3rd Generation,HBO Max,,None,Cook Islands,Avarua,,750b2dec-bdbb-4160-95b4-695286ccc01c,Video,rmclean,54-6317919,1163798,101600
Device/Browser Compatibility,Laptop,01/12/2021 00:00:00,rhoncus sed vestibulum sit amet cursus id turpis integer aliquet massa id lobortis,2876560313,nlinay85@zimbio.com,Email,Akamai,Amazon Fire TV,All Fire TV devices,Zee5,,FireOS 7.6.1.3,Namibia,Windhoek,,54dba23a-4c4b-4f00-b6fa-81a13de25a9c,Video,tammy07,84-1337543,1225433,68750
Security and anti-piracy,Mobile,07/07/2022 00:00:00,ut massa quis augue luctus tincidunt nulla mollis molestie lorem quisque ut erat curabitur gravida nisi at nibh,3692114680,jslark86@marriott.com,Phone Call,Akamai,Universal Windows Platform (UWP),Xbox One X/S,Airtel Xstream,,Windows 10,Ghana,Accra,,430938cb-b2e0-4749-8e11-309547147bda,Advertise,wattsricardo,02-8352640,1563134,2412732
Functionalities and features of the app,Laptop,21/04/2022 00:00:00,at turpis a pede posuere nonummy integer non velit donec diam neque vestibulum eget vulputate ut ultrices,1478464194,fwoodwin87@goo.gl,Email,Cloudfront,Samsung Tizen TV,21TV_PREMIUM2,Facebook Watch,,Extension 6.5,Saint Helena,Jamestown,,2ca16007-5a8d-4046-886e-f5198d3342b5,Video,ugriffin,94-0724785,1559877,2490912
Security and anti-piracy,TV,16/06/2022 00:00:00,libero ut massa volutpat convallis morbi odio odio elementum eu interdum eu tincidunt in leo,3280007437,vfrissell88@google.it,Phone Call,Cloudfront,iOS,iOS Min version 12.6,Airtel Xstream,,macOS Ventura 13.0.1,Palestinian Territory,East Jerusalem,,69f28212-639a-483c-a372-cf6cf516dde1,Advertise,uthomas,70-4272152,1437216,1997875
Device/Browser Compatibility,Tablets,27/05/2022 00:00:00,habitasse platea dictumst aliquam augue quam sollicitudin vitae consectetuer eget rutrum at lorem integer tincidunt ante vel ipsum praesent,3523185009,wtancock89@clickbank.net,Chat,Akamai,tvOS,tvOS 11.0,Mx Player,,Xcode 14.1,Micronesia,Palikir,,019477e1-0b9b-4682-b3ef-28e4c3e70bbe,Video,tracie77,58-9043238,1347244,1946369
Functionalities and features of the app,Tablets,07/11/2022 00:00:00,at turpis donec posuere metus vitae ipsum aliquam non mauris morbi,3641200784,tgawler8a@census.gov,Phone Call,Cloudfront,Android,Android 5.0,YouTube TV,,Android 11,Jersey,Saint Helier,,0f5d4489-2de7-4e05-a21e-a7b144be278a,Video,knightstephanie,45-9099787,1124063,1809977
Security and anti-piracy,Tablets,15/04/2022 00:00:00,vel pede morbi porttitor lorem id ligula suspendisse ornare consequat lectus in est risus auctor sed tristique,2105348629,ncarlisso8b@ehow.com,Chat,Akamai,Android TV,Android TV 1st Generation,Amazon Prime Video,,Android TV 12.3.2,Bangladesh,Dhaka,,8f3d6168-f2a2-4ebc-aee8-05b7a7d65316,Advertise,philipjimenez,65-6577499,1395426,1066579
Customer Support,Mobile,16/04/2022 00:00:00,diam id ornare imperdiet sapien urna pretium nisl ut volutpat sapien arcu,8009581577,mpickavant8c@princeton.edu,Phone Call,Cloudfront,Roku,Roku OS 9.4 3rd Generation,Hulu,,None,Sint Maarten,Philipsburg,,00387c1c-f1bc-424b-9a4e-96eac2200158,Video,williammcknight,21-4954384,1313483,493909
Playback Quality,Mobile,18/10/2022 00:00:00,consequat dui nec nisi volutpat eleifend donec ut dolor morbi vel lectus in quam fringilla rhoncus mauris enim leo,9254860859,mmcdaid8d@amazon.co.jp,Chat,Cloudfront,Amazon Fire TV,All Fire TV devices,Netflix,,FireOS 7.6.1.3,China,Beijing,,103f389d-a0bd-402a-837a-63cde609e470,Video,christina94,91-9545400,1704941,955756
Multiple user accounts,Tablets,29/07/2022 00:00:00,nulla nisl nunc nisl duis bibendum felis sed interdum venenatis turpis enim blandit mi in porttitor pede,5370523487,tshama8e@dell.com,Email,Cloudfront,Universal Windows Platform (UWP),Xbox One X/S,Facebook Watch,,Windows 10,Republic of the Congo,Brazzaville,,2e7813ef-fc8d-4b10-a821-b49b3e5d90f3,Advertise,jamesbird,45-3558767,1420165,2356704
Playback Quality,Desktop,13/07/2022 00:00:00,massa tempor convallis nulla neque libero convallis eget eleifend luctus ultricies eu nibh quisque,8828917253,slefevre8f@scribd.com,Email,Cloudfront,Samsung Tizen TV,21TV_PREMIUM2,Sling TV,,Extension 6.5,Montenegro,Podgorica,,0268e163-0506-4b04-9ee5-68c680ad3fac,Video,montgomerytristan,41-5390973,1600427,1584312
Device/Browser Compatibility,Tablets,26/03/2022 00:00:00,sagittis sapien cum sociis natoque penatibus et magnis dis parturient montes nascetur ridiculus mus etiam vel augue vestibulum rutrum rutrum,5595531533,lbrehault8g@dyndns.org,Phone Call,Cloudfront,iOS,iOS Min version 12.6,YouTube TV,,macOS Ventura 13.0.1,Puerto Rico,San Juan,,1c608f4c-9856-474a-a414-3ce6db3f3962,Video,michael66,45-4469689,1722344,1884366
Offline content,Tablets,30/11/2021 00:00:00,ut rhoncus aliquet pulvinar sed nisl nunc rhoncus dui vel sem sed sagittis nam congue risus semper porta volutpat,9573872463,mhaack8h@wunderground.com,Email,Akamai,tvOS,tvOS 11.0,Alt Balaji,,Xcode 14.1,Turkey,Ankara,,b8a6f005-a98a-4a95-b9e4-da120dc46bfd,Advertise,lukesmith,51-3353443,1535647,115677
Response Time in different networks,Laptop,08/01/2022 00:00:00,ridiculus mus vivamus vestibulum sagittis sapien cum sociis natoque penatibus et magnis dis parturient montes nascetur ridiculus,8999827321,llesley8i@samsung.com,Phone Call,Cloudfront,Android,Android 5.0,Eros Now,,Android 11,Mauritius,Port Louis,,f6457c15-7de6-4999-81ed-beaf0ddf3928,Video,karenjordan,86-3761238,1774831,2094920
Better user interface and workability,Mobile,16/07/2022 00:00:00,ultrices posuere cubilia curae nulla dapibus dolor vel est donec odio justo sollicitudin ut suscipit a feugiat et eros vestibulum,7404927749,nlinney8j@utexas.edu,Email,Cloudfront,Android TV,Android TV 1st Generation,HBO Max,,Android TV 12.3.2,Nauru,Yaren,,e7c6d677-02d2-4005-9648-d21f3f6d07d9,Video,sarahernandez,71-5467655,1385836,2242023
Multiple user accounts,Tablets,19/08/2022 00:00:00,magnis dis parturient montes nascetur ridiculus mus vivamus vestibulum sagittis,8733859752,kvanbrug8k@printfriendly.com,Chat,Cloudfront,Roku,Roku OS 9.4 3rd Generation,ShemarooMe,,None,Belarus,Minsk,,58a74221-b9f3-47e1-b61b-6c68240b09ba,Video,jeremy51,19-2977601,1211897,889395
Response Time in different networks,Desktop,09/03/2022 00:00:00,nisi eu orci mauris lacinia sapien quis libero nullam sit,6676482509,epearle8l@nsw.gov.au,Phone Call,Akamai,Amazon Fire TV,All Fire TV devices,Jio Tv,,FireOS 7.6.1.3,Norway,Oslo,,f49c7c45-ece8-4381-888c-1cec065f608f,Video,travisturner,92-3839968,1241781,2308836
Functionalities and features of the app,TV,22/11/2021 00:00:00,mauris ullamcorper purus sit amet nulla quisque arcu libero rutrum ac lobortis vel dapibus,9524300079,ggasken8m@yelp.com,Email,Akamai,Universal Windows Platform (UWP),Xbox One X/S,Eros Now,,Windows 10,Taiwan,Taipei,,75f678dd-bd05-42dd-905f-20042c697e9e,Advertise,arellanodanielle,41-0414157,1538187,1029119
Functionalities and features of the app,Laptop,08/07/2022 00:00:00,condimentum neque sapien placerat ante nulla justo aliquam quis turpis eget elit sodales scelerisque mauris,9892252225,fbrickstock8n@dropbox.com,Email,Akamai,Samsung Tizen TV,21TV_PREMIUM2,Disney + Hotstar,,Extension 6.5,Christmas Island,Flying Fish Cove,,81e77233-1606-46ca-8906-7d4079b93f2b,Advertise,oallen,93-1745834,1770099,555469
Functionalities and features of the app,Laptop,24/10/2022 00:00:00,aliquam sit amet diam in magna bibendum imperdiet nullam orci pede venenatis non sodales sed tincidunt eu felis,2217585096,bnana8o@infoseek.co.jp,Phone Call,Akamai,iOS,iOS Min version 12.6,Netflix,,macOS Ventura 13.0.1,Madagascar,Antananarivo,,283c2668-1ef5-44af-b794-b1ca3a8a3915,Video,fbauer,94-1473372,1246068,2408022
Security and anti-piracy,Tablets,29/01/2022 00:00:00,pretium iaculis justo in hac habitasse platea dictumst etiam faucibus cursus urna ut tellus nulla ut erat,9702512719,blangton8p@census.gov,Phone Call,Cloudfront,tvOS,tvOS 11.0,Amazon Prime Video,,Xcode 14.1,Montserrat,Plymouth,,23d3bef7-db36-48c3-adfb-cfca11eb7862,Video,irichards,78-7632477,1738925,1794874
Playback Quality,TV,07/09/2022 00:00:00,sodales sed tincidunt eu felis fusce posuere felis sed lacus morbi sem,2293550664,mcardenas8q@ucsd.edu,Email,Akamai,Android,Android 5.0,Alt Balaji,,Android 11,Moldova,Chisinau,,1065c182-28a8-496f-9a2b-e37a1fe93d77,Video,aadams,81-4888205,1546660,1518155
Device/Browser Compatibility,Tablets,06/09/2022 00:00:00,erat quisque erat eros viverra eget congue eget semper rutrum nulla nunc purus phasellus in felis donec semper sapien a,5636646682,cfiander8r@ehow.com,Phone Call,Cloudfront,Android TV,Android TV 1st Generation,HBO Max,,Android TV 12.3.2,Trinidad and Tobago,Port of Spain,,d176733b-79f6-4b17-bd6f-855942861413,Advertise,michaelnguyen,91-4595509,1363538,91737
Functionalities and features of the app,TV,18/11/2022 00:00:00,posuere metus vitae ipsum aliquam non mauris morbi non lectus,175004684,hkeyzor8s@dell.com,Email,Akamai,Roku,Roku OS 9.4 3rd Generation,Alt Balaji,,None,Tunisia,Tunis,,2e792c55-932e-4003-9493-1dc6a278cf51,Video,brittany95,49-5458980,1173975,2012555
Customer Support,TV,15/10/2022 00:00:00,justo pellentesque viverra pede ac diam cras pellentesque volutpat dui maecenas tristique est et tempus semper est,8514780964,tleek8t@google.com.br,Email,Akamai,Amazon Fire TV,All Fire TV devices,Zee5,,FireOS 7.6.1.3,Bhutan,Thimphu,,f72b25ec-5658-480e-81a4-10f38eea1ede,Video,melissa04,49-0265468,1527645,301870
Customer Support,Tablets,04/08/2022 00:00:00,sapien non mi integer ac neque duis bibendum morbi non quam nec dui luctus rutrum nulla tellus,9030955597,rrockwell8u@shinystat.com,Phone Call,Cloudfront,Universal Windows Platform (UWP),Xbox One X/S,Disney + Hotstar,,Windows 10,Democratic Republic of the Congo,Kinshasa,,12a12792-2486-4df4-8f17-580b53663a6a,Advertise,spearsmary,59-9308061,1269451,722180
Better user interface and workability,Desktop,01/04/2022 00:00:00,interdum venenatis turpis enim blandit mi in porttitor pede justo eu massa donec dapibus duis at velit eu,4275710207,rdas8v@sina.com.cn,Email,Akamai,Samsung Tizen TV,21TV_PREMIUM2,Facebook Watch,,Extension 6.5,United Arab Emirates,Abu Dhabi,,c26f282f-6594-4e97-ac46-83feeb35a75c,Video,williamlopez,19-1337067,1635930,1201801
Response Time in different networks,Tablets,16/01/2022 00:00:00,vivamus in felis eu sapien cursus vestibulum proin eu mi nulla ac enim in tempor turpis nec euismod scelerisque quam,126810966,fmackro8w@unesco.org,Phone Call,Akamai,iOS,iOS Min version 12.6,Zee5,,macOS Ventura 13.0.1,Aland Islands,Mariehamn,,658dc308-6886-4363-9cb2-5871b896a1c6,Advertise,eguerrero,39-3372921,1443537,1871111
Functionalities and features of the app,Tablets,20/04/2022 00:00:00,purus aliquet at feugiat non pretium quis lectus suspendisse potenti,915139731,cgoldes8x@bloglines.com,Chat,Akamai,tvOS,tvOS 11.0,Eros Now,,Xcode 14.1,Sao Tome and Principe,Sao Tome,,7ccf8232-f238-465d-91ef-81732bfcaa67,Advertise,sara59,96-2566496,1366526,126005
Playback Quality,Desktop,26/02/2022 00:00:00,posuere felis sed lacus morbi sem mauris laoreet ut rhoncus aliquet pulvinar,3705373781,dpancost8y@telegraph.co.uk,Chat,Cloudfront,Android,Android 5.0,Facebook Watch,,Android 11,Peru,Lima,,b23eda92-93fd-432c-ba04-15f23b81a9d2,Video,joshuabell,96-2106322,1492566,2428039
Device/Browser Compatibility,Tablets,13/08/2022 00:00:00,nisi eu orci mauris lacinia sapien quis libero nullam sit amet turpis elementum ligula vehicula,4270883391,bausting8z@omniture.com,Phone Call,Cloudfront,Android TV,Android TV 1st Generation,Zee5,,Android TV 12.3.2,Croatia,Zagreb,,49e4be33-e62e-48ad-8d20-35043410f441,Video,angelajohnson,59-2268320,1212992,1719215
Offline content,Laptop,11/06/2022 00:00:00,morbi non quam nec dui luctus rutrum nulla tellus in sagittis dui,5096667502,ewombwell90@topsy.com,Phone Call,Akamai,Roku,Roku OS 9.4 3rd Generation,Sling TV,,None,Mayotte,Mamoudzou,,c2bc098c-6bfd-498a-9f9f-ffde1071683b,Video,deannaduke,94-4607022,1449219,2277131
Offline content,Tablets,07/07/2022 00:00:00,eu magna vulputate luctus cum sociis natoque penatibus et magnis dis parturient montes nascetur ridiculus mus,2833090986,vwoolford91@springer.com,Chat,Cloudfront,Amazon Fire TV,All Fire TV devices,Alt Balaji,,FireOS 7.6.1.3,Latvia,Riga,,c90eadc4-a05b-438e-8889-b65a5a10d694,Video,brownstacy,88-0043729,1113782,1118464
Functionalities and features of the app,TV,09/07/2022 00:00:00,orci nullam molestie nibh in lectus pellentesque at nulla suspendisse potenti cras in purus eu magna vulputate,388202394,eholme92@canalblog.com,Phone Call,Cloudfront,Universal Windows Platform (UWP),Xbox One X/S,Sonyliv,,Windows 10,Morocco,Rabat,,b9ba5b0f-0c4e-4a17-a508-f6eb0df61e68,Advertise,lindseymoses,95-5769109,1127014,1997215
Customer Support,Tablets,20/01/2022 00:00:00,dui nec nisi volutpat eleifend donec ut dolor morbi vel,4627590806,idayer93@github.io,Email,Akamai,Samsung Tizen TV,21TV_PREMIUM2,Sonyliv,,Extension 6.5,South Sudan,Juba,,1c10bcc0-8acf-4cc9-97f4-6af39692c27f,Advertise,donna69,06-3378910,1730202,1992310
Response Time in different networks,Mobile,11/02/2022 00:00:00,dignissim vestibulum vestibulum ante ipsum primis in faucibus orci luctus et ultrices posuere cubilia curae nulla dapibus,3407685041,dtosspell94@icq.com,Phone Call,Cloudfront,iOS,iOS Min version 12.6,Facebook Watch,,macOS Ventura 13.0.1,Bulgaria,Sofia,,72a5d21b-6ab7-46c1-bef0-9c2f10a8442d,Video,gardnerbrooke,08-7105984,1831874,1941780
Playback Quality,TV,10/06/2022 00:00:00,felis sed interdum venenatis turpis enim blandit mi in porttitor pede justo eu massa donec dapibus duis at velit eu,3435171642,mricardo95@amazon.co.jp,Phone Call,Akamai,tvOS,tvOS 11.0,Hulu,,Xcode 14.1,Panama,Panama City,,787ce7b6-47f4-40f0-9676-c86781cbedf4,Advertise,smithmichael,53-6060789,1839770,7887
Playback Quality,Tablets,02/12/2021 00:00:00,interdum venenatis turpis enim blandit mi in porttitor pede justo eu massa,9394797939,cwalisiak96@ed.gov,Phone Call,Cloudfront,Android,Android 5.0,Sonyliv,,Android 11,Kazakhstan,Astana,,f89bd3fc-50e4-4ac7-ace5-c86a1dd31981,Video,johnwilliams,07-0640844,1397184,1415737
Multiple user accounts,Desktop,04/08/2022 00:00:00,nisi vulputate nonummy maecenas tincidunt lacus at velit vivamus vel nulla,8328580802,lbockh97@phoca.cz,Chat,Akamai,Android TV,Android TV 1st Generation,Sonyliv,,Android TV 12.3.2,Uruguay,Montevideo,,90304e56-3fde-4518-86d8-e3633b354e59,Video,sharonsmith,77-9403171,1893558,805238
Offline content,Mobile,17/11/2022 00:00:00,sed ante vivamus tortor duis mattis egestas metus aenean fermentum donec ut mauris eget massa tempor convallis nulla neque,1695374622,zmagne98@jiathis.com,Phone Call,Akamai,Roku,Roku OS 9.4 3rd Generation,Peacock,,None,Uganda,Kampala,,f7eafae4-b513-4e9a-80fb-f5a66e464e0b,Advertise,dcallahan,16-5492605,1392044,1599986
Security and anti-piracy,Desktop,21/03/2022 00:00:00,vitae mattis nibh ligula nec sem duis aliquam convallis nunc proin at turpis a pede posuere nonummy integer non,7010975833,kjorn99@clickbank.net,Phone Call,Akamai,Amazon Fire TV,All Fire TV devices,Peacock,,FireOS 7.6.1.3,India,New Delhi,,9d90f90c-6622-441d-a5bb-c5a029bdaaa1,Advertise,tjackson,00-0263842,1658501,610223
Personalized suggestions and recommendations for content,Mobile,12/08/2022 00:00:00,ut tellus nulla ut erat id mauris vulputate elementum nullam,6885649147,ibuer9a@epa.gov,Email,Cloudfront,Universal Windows Platform (UWP),Xbox One X/S,Airtel Xstream,,Windows 10,Papua New Guinea,Port Moresby,,297e74d0-3f22-4e77-8bb3-305290106983,Advertise,nicole17,65-4732309,1749671,1214733
Security and anti-piracy,TV,26/04/2022 00:00:00,in faucibus orci luctus et ultrices posuere cubilia curae nulla dapibus dolor vel est donec odio,5716929990,aaronin9b@columbia.edu,Email,Akamai,Samsung Tizen TV,21TV_PREMIUM2,Netflix,,Extension 6.5,Cocos Islands,West Island,,32c5f250-bc76-4919-bfb6-715e576fa642,Advertise,mark40,12-4845111,1497135,1310946
Customer Support,Mobile,14/09/2022 00:00:00,ut tellus nulla ut erat id mauris vulputate elementum nullam varius nulla facilisi cras non velit nec nisi vulputate nonummy,2767481595,srodgerson9c@163.com,Email,Cloudfront,iOS,iOS Min version 12.6,Disney + Hotstar,,macOS Ventura 13.0.1,Curacao,Willemstad,,7d352687-e0ef-4254-9637-5f34d8358558,Video,michelle99,43-6581881,1742101,722527
Security and anti-piracy,Laptop,03/12/2021 00:00:00,pellentesque viverra pede ac diam cras pellentesque volutpat dui maecenas tristique,4194870565,jhuston9d@gmpg.org,Chat,Akamai,tvOS,tvOS 11.0,Netflix,,Xcode 14.1,Malawi,Lilongwe,,9c415c5e-3d26-4b01-8a66-d64c2b9aff2b,Video,rebeccapadilla,77-5976100,1674059,2156955
Security and anti-piracy,Laptop,27/05/2022 00:00:00,enim lorem ipsum dolor sit amet consectetuer adipiscing elit proin interdum mauris non ligula,7627299489,aturbat9e@theatlantic.com,Chat,Cloudfront,Android,Android 5.0,YouTube TV,,Android 11,Solomon Islands,Honiara,,a4d68936-a097-4f4a-82ab-5a76aa6bf2dc,Advertise,rachelharris,78-0596405,1507864,2239437
Offline content,Tablets,09/05/2022 00:00:00,dolor quis odio consequat varius integer ac leo pellentesque ultrices mattis,1539418774,mboise9f@nymag.com,Phone Call,Cloudfront,Android TV,Android TV 1st Generation,Disney + Hotstar,,Android TV 12.3.2,Laos,Vientiane,,26e7e83c-a22f-4cb6-8616-5a76032c8513,Advertise,knightbrian,31-9671739,1191977,325077
Customer Support,Desktop,01/12/2021 00:00:00,sed interdum venenatis turpis enim blandit mi in porttitor pede justo eu massa donec dapibus duis,9884219753,elavalde9g@google.ru,Email,Akamai,Roku,Roku OS 9.4 3rd Generation,BigFlix,,None,Lithuania,Vilnius,,d8bdbb67-0cab-431c-b80f-50352047789f,Advertise,robert99,65-8798923,1572898,1160998
Device/Browser Compatibility,Laptop,24/04/2022 00:00:00,pellentesque viverra pede ac diam cras pellentesque volutpat dui maecenas tristique est et tempus,3896912046,tdobbinson9h@studiopress.com,Phone Call,Akamai,Amazon Fire TV,All Fire TV devices,Disney + Hotstar,,FireOS 7.6.1.3,Serbia,Belgrade,,65cefc4d-ad2c-455b-a0a5-f75d52cdfa40,Video,lbaldwin,03-7427781,1193436,1263989
Playback Quality,Tablets,14/09/2022 00:00:00,erat tortor sollicitudin mi sit amet lobortis sapien sapien non mi integer ac neque duis bibendum morbi,7344604574,scomizzoli9i@nhs.uk,Phone Call,Akamai,Universal Windows Platform (UWP),Xbox One X/S,Peacock,,Windows 10,Nicaragua,Managua,,05255bdc-c3ff-4c6e-bf22-82cc3ef22681,Video,gabriel48,97-7087845,1182073,983744
Response Time in different networks,Desktop,27/11/2021 00:00:00,nulla eget eros elementum pellentesque quisque porta volutpat erat quisque erat eros viverra eget,2383537616,ccaney9j@live.com,Phone Call,Akamai,Samsung Tizen TV,21TV_PREMIUM2,ShemarooMe,,Extension 6.5,Sri Lanka,Colombo,,f4ab25a7-de44-4a71-ae00-a3934bf0dd44,Advertise,aodonnell,26-8053027,1424965,1970118
Response Time in different networks,TV,13/03/2022 00:00:00,consequat ut nulla sed accumsan felis ut at dolor quis odio consequat varius integer ac leo,9858188773,jkenninghan9k@businesswire.com,Chat,Akamai,iOS,iOS Min version 12.6,Hulu,,macOS Ventura 13.0.1,Venezuela,Caracas,,aa205e27-d632-4a80-83c2-1a8da928ba79,Video,patricia07,94-9666221,1608183,1294716
Multiple user accounts,Tablets,25/04/2022 00:00:00,platea dictumst maecenas ut massa quis augue luctus tincidunt nulla mollis molestie lorem quisque ut erat curabitur,4669230530,mattlee9l@tripod.com,Chat,Cloudfront,tvOS,tvOS 11.0,YouTube TV,,Xcode 14.1,North Korea,Pyongyang,,e7e04099-56e4-4b85-8877-ae64ff9beb51,Advertise,jerry55,62-7731166,1473941,2310273
Security and anti-piracy,Mobile,22/01/2022 00:00:00,cras pellentesque volutpat dui maecenas tristique est et tempus semper est quam pharetra magna ac consequat,4699036198,ccrosser9m@github.io,Chat,Akamai,Android,Android 5.0,Hulu,,Android 11,Switzerland,Berne,,20d34adf-e515-486b-a8e2-e15b90645d2a,Advertise,vhines,18-2515232,1540515,1148165
Response Time in different networks,Desktop,06/10/2022 00:00:00,morbi vestibulum velit id pretium iaculis diam erat fermentum justo nec condimentum,4572676143,jrisebrow9n@statcounter.com,Phone Call,Cloudfront,Android TV,Android TV 1st Generation,BigFlix,,Android TV 12.3.2,Cape Verde,Praia,,1f3eb207-478b-48a4-8c2d-a4b854cf2cb8,Video,garciajames,02-9851858,1318823,1155878
Multiple user accounts,TV,29/06/2022 00:00:00,ultricies eu nibh quisque id justo sit amet sapien dignissim vestibulum vestibulum ante ipsum primis in faucibus orci,9007637614,zferroni9o@dropbox.com,Email,Akamai,Roku,Roku OS 9.4 3rd Generation,HBO Max,,None,Spain,Madrid,,22cd7667-5e1c-49ec-8407-fd8821cd1747,Video,janicecohen,40-5525899,1545574,1092546
Response Time in different networks,Desktop,31/03/2022 00:00:00,lacus morbi quis tortor id nulla ultrices aliquet maecenas leo odio condimentum,790791730,jwetherburn9p@desdev.cn,Email,Akamai,Amazon Fire TV,All Fire TV devices,Netflix,,FireOS 7.6.1.3,Dominican Republic,Santo Domingo,,e7dcc426-9bab-479c-afe8-0a8ad096c71a,Advertise,albertfriedman,38-2223676,1408229,1268064
Customer Support,TV,16/05/2022 00:00:00,convallis nulla neque libero convallis eget eleifend luctus ultricies eu nibh,2527791190,gmceachern9q@nba.com,Chat,Akamai,Universal Windows Platform (UWP),Xbox One X/S,Sonyliv,,Windows 10,United States,Washington,,1a02f017-0450-4015-8a68-0f450fd83853,Video,fordchristian,36-5527622,1605868,316116
Better user interface and workability,Desktop,25/06/2022 00:00:00,ante ipsum primis in faucibus orci luctus et ultrices posuere,5966666571,jstops9r@merriam/webster.com,Email,Akamai,Samsung Tizen TV,21TV_PREMIUM2,Jio Tv,,Extension 6.5,Nigeria,Abuja,,2e296f28-a67c-4273-93cb-cd91b74aefec,Video,bridgesjacob,04-3353578,1176865,1790128
Customer Support,Laptop,14/08/2022 00:00:00,luctus et ultrices posuere cubilia curae nulla dapibus dolor vel est donec,2826106600,dbeebis9s@privacy.gov.au,Phone Call,Cloudfront,iOS,iOS Min version 12.6,Airtel Xstream,,macOS Ventura 13.0.1,Svalbard and Jan Mayen,Longyearbyen,,0c941127-bdb4-48ec-b01b-f3c9838a3615,Advertise,nathaniel71,23-3816658,1806619,2335116
